Q8DTQ9	Imidazoleglycerol-phosphate dehydratase (IGPD) (EC 4.2.1.19)	hisB SMU_1268		194	21594	PATHWAY: Amino-acid biosynthesis; L-histidine biosynthesis; L-histidine from 5-phospho-alpha-D-ribose 1-diphosphate: step 6/9. {ECO:0000255|HAMAP-Rule:MF_00076}.	L-histidine biosynthetic process [GO:0000105]	cytoplasm [GO:0005737]	imidazoleglycerol-phosphate dehydratase activity [GO:0004424]	
Q8DTQ4	Histidinol-phosphate aminotransferase (EC 2.6.1.9) (Imidazole acetol-phosphate transaminase)	hisC SMU_1273		349	39443	PATHWAY: Amino-acid biosynthesis; L-histidine biosynthesis; L-histidine from 5-phospho-alpha-D-ribose 1-diphosphate: step 7/9. {ECO:0000255|HAMAP-Rule:MF_01023}.	L-histidine biosynthetic process [GO:0000105]		histidinol-phosphate transaminase activity [GO:0004400]; pyridoxal phosphate binding [GO:0030170]	
Q8DTQ7	Histidinol dehydrogenase (HDH) (EC 1.1.1.23)	hisD SMU_1270		427	46451	PATHWAY: Amino-acid biosynthesis; L-histidine biosynthesis; L-histidine from 5-phospho-alpha-D-ribose 1-diphosphate: step 9/9. {ECO:0000255|HAMAP-Rule:MF_01024}.	L-histidine biosynthetic process [GO:0000105]	cytosol [GO:0005829]	histidinol dehydrogenase activity [GO:0004399]; NAD binding [GO:0051287]; zinc ion binding [GO:0008270]	
Q8DTR3	Imidazole glycerol phosphate synthase subunit HisF (EC 4.3.2.10) (IGP synthase cyclase subunit) (IGP synthase subunit HisF) (ImGP synthase subunit HisF) (IGPS subunit HisF)	hisF SMU_1264		251	26874	PATHWAY: Amino-acid biosynthesis; L-histidine biosynthesis; L-histidine from 5-phospho-alpha-D-ribose 1-diphosphate: step 5/9. {ECO:0000255|HAMAP-Rule:MF_01013}.	L-histidine biosynthetic process [GO:0000105]	cytoplasm [GO:0005737]	imidazoleglycerol-phosphate synthase activity [GO:0000107]; lyase activity [GO:0016829]	
Q8DTQ6	ATP phosphoribosyltransferase (ATP-PRT) (ATP-PRTase) (EC 2.4.2.17)	hisG SMU_1271		215	23909	PATHWAY: Amino-acid biosynthesis; L-histidine biosynthesis; L-histidine from 5-phospho-alpha-D-ribose 1-diphosphate: step 1/9. {ECO:0000255|HAMAP-Rule:MF_01018}.	L-histidine biosynthetic process [GO:0000105]	cytoplasm [GO:0005737]	ATP binding [GO:0005524]; ATP phosphoribosyltransferase activity [GO:0003879]	
Q8DTR1	Imidazole glycerol phosphate synthase subunit HisH (EC 4.3.2.10) (IGP synthase glutaminase subunit) (EC 3.5.1.2) (IGP synthase subunit HisH) (ImGP synthase subunit HisH) (IGPS subunit HisH)	hisH SMU_1266		201	21414	PATHWAY: Amino-acid biosynthesis; L-histidine biosynthesis; L-histidine from 5-phospho-alpha-D-ribose 1-diphosphate: step 5/9. {ECO:0000255|HAMAP-Rule:MF_00278}.	L-histidine biosynthetic process [GO:0000105]	cytoplasm [GO:0005737]	glutaminase activity [GO:0004359]; imidazoleglycerol-phosphate synthase activity [GO:0000107]; lyase activity [GO:0016829]	
Q8DTR4	Phosphoribosyl-AMP cyclohydrolase (PRA-CH) (EC 3.5.4.19)	hisI SMU_1263		109	12535	PATHWAY: Amino-acid biosynthesis; L-histidine biosynthesis; L-histidine from 5-phospho-alpha-D-ribose 1-diphosphate: step 3/9. {ECO:0000255|HAMAP-Rule:MF_01021}.	L-histidine biosynthetic process [GO:0000105]	cytoplasm [GO:0005737]	magnesium ion binding [GO:0000287]; phosphoribosyl-AMP cyclohydrolase activity [GO:0004635]; zinc ion binding [GO:0008270]	
Q8CWW2	Histidine--tRNA ligase (EC 6.1.1.21) (Histidyl-tRNA synthetase) (HisRS)	hisS SMU_2102		429	48897		histidyl-tRNA aminoacylation [GO:0006427]	cytoplasm [GO:0005737]	"ATP binding [GO:0005524]; catalytic activity, acting on a protein [GO:0140096]; histidine-tRNA ligase activity [GO:0004821]; transferase activity [GO:0016740]"	
Q8DTQ5	ATP phosphoribosyltransferase regulatory subunit	hisZ SMU_1272		320	36449	PATHWAY: Amino-acid biosynthesis; L-histidine biosynthesis; L-histidine from 5-phospho-alpha-D-ribose 1-diphosphate: step 1/9. {ECO:0000255|HAMAP-Rule:MF_00125}.	histidyl-tRNA aminoacylation [GO:0006427]; L-histidine biosynthetic process [GO:0000105]	cytoplasm [GO:0005737]	"catalytic activity, acting on a protein [GO:0140096]; histidine-tRNA ligase activity [GO:0004821]; transferase activity [GO:0016740]"	
I6L8Z1	Hemolysin	hlyX SMU_1693		445	49790			plasma membrane [GO:0005886]	flavin adenine dinucleotide binding [GO:0050660]	
Q8DSU7	"DNA polymerase III, delta subunit (EC 2.7.7.7)"	holB SMU_1662		291	33584		DNA-templated DNA replication [GO:0006261]		DNA-directed DNA polymerase activity [GO:0003887]	
Q8DVI8	Ribosome hibernation promoting factor (HPF)	hpf SMU_500		182	21086		negative regulation of translational elongation [GO:0045900]	cytosolic small ribosomal subunit [GO:0022627]	ribosomal small subunit binding [GO:0043024]	
Q9ZA56	HPr kinase/phosphorylase (HPrK/P) (EC 2.7.11.-) (EC 2.7.4.-) (HPr(Ser) kinase/phosphorylase)	hprK SMU_754		311	34884		regulation of carbohydrate metabolic process [GO:0006109]		ATP binding [GO:0005524]; magnesium ion binding [GO:0000287]; phosphorelay sensor kinase activity [GO:0000155]; protein serine/threonine kinase activity [GO:0004674]; protein serine/threonine/tyrosine kinase activity [GO:0004712]	
Q8DWM8	Hypoxanthine-guanine phosphoribosyltransferase (HGPRT) (HGPRTase) (EC 2.4.2.8)	hpt SMU_14		180	20542	PATHWAY: Purine metabolism; IMP biosynthesis via salvage pathway; IMP from hypoxanthine: step 1/1. {ECO:0000250|UniProtKB:P9WHQ9}.; PATHWAY: Purine metabolism; GMP biosynthesis via salvage pathway; GMP from guanine: step 1/1. {ECO:0000250|UniProtKB:P9WHQ9}.	GMP salvage [GO:0032263]; guanine salvage [GO:0006178]; hypoxanthine metabolic process [GO:0046100]; IMP salvage [GO:0032264]; purine ribonucleoside salvage [GO:0006166]	cytosol [GO:0005829]	guanine phosphoribosyltransferase activity [GO:0052657]; hypoxanthine phosphoribosyltransferase activity [GO:0004422]; magnesium ion binding [GO:0000287]; nucleotide binding [GO:0000166]	
O06940	Heat-inducible transcription repressor HrcA	hrcA SMU_80		344	39231		negative regulation of DNA-templated transcription [GO:0045892]		DNA binding [GO:0003677]	9282745; 
Q8DUM7	site-specific DNA-methyltransferase (adenine-specific) (EC 2.1.1.72)	hsdM SMU_891		534	60593		DNA restriction-modification system [GO:0009307]; methylation [GO:0032259]		DNA binding [GO:0003677]; N-methyltransferase activity [GO:0008170]; site-specific DNA-methyltransferase (adenine-specific) activity [GO:0009007]	
Q8DUM6	"Type I restriction-modification system, specificity determinant"	hsdS SMU_892		603	69784		DNA restriction-modification system [GO:0009307]		DNA binding [GO:0003677]	
Q8CWZ3	33 kDa chaperonin (Heat shock protein 33 homolog) (HSP33)	hslO SMU_188c		290	31779		protein refolding [GO:0042026]	cytoplasm [GO:0005737]	protein folding chaperone [GO:0044183]; unfolded protein binding [GO:0051082]	
Q93D93	Protease HtpX homolog (EC 3.4.24.-)	htpX SMU_1929		299	32725		proteolysis [GO:0006508]	plasma membrane [GO:0005886]	metalloendopeptidase activity [GO:0004222]; zinc ion binding [GO:0008270]	
Q8DRQ6	Serine protease HtrA	htrA SMU_2164		402	43072		proteolysis [GO:0006508]	membrane [GO:0016020]	serine-type endopeptidase activity [GO:0004252]	
Q9XB21	DNA-binding protein HU	hup hlpA SMU_589		91	9706		chromosome condensation [GO:0030261]	cytosol [GO:0005829]	DNA binding [GO:0003677]; structural constituent of chromatin [GO:0030527]	9423866; 
Q59940	Isocitrate dehydrogenase [NADP] (IDH) (EC 1.1.1.42) (IDP) (NADP(+)-specific ICDH) (Oxalosuccinate decarboxylase)	icd idh SMU_672		393	43141		glyoxylate cycle [GO:0006097]; tricarboxylic acid cycle [GO:0006099]		isocitrate dehydrogenase (NADP+) activity [GO:0004450]; magnesium ion binding [GO:0000287]; NAD binding [GO:0051287]	
Q8DVD3	Isoleucine--tRNA ligase (EC 6.1.1.5) (Isoleucyl-tRNA synthetase) (IleRS)	ileS SMU_558		930	105853		isoleucyl-tRNA aminoacylation [GO:0006428]	cytosol [GO:0005829]	aminoacyl-tRNA deacylase activity [GO:0002161]; ATP binding [GO:0005524]; isoleucine-tRNA ligase activity [GO:0004822]; tRNA binding [GO:0000049]; zinc ion binding [GO:0008270]	
Q8DW42	L-threonine dehydratase (EC 4.3.1.19) (Threonine deaminase)	ilvA SMU_234		416	45505	"PATHWAY: Amino-acid biosynthesis; L-isoleucine biosynthesis; 2-oxobutanoate from L-threonine: step 1/1. {ECO:0000256|ARBA:ARBA00004810, ECO:0000256|RuleBase:RU362012}."	isoleucine biosynthetic process [GO:0009097]; L-serine catabolic process [GO:0006565]; threonine catabolic process [GO:0006567]		L-serine ammonia-lyase activity [GO:0003941]; pyridoxal phosphate binding [GO:0030170]; threonine deaminase activity [GO:0004794]	
Q8DW45	Acetolactate synthase (EC 2.2.1.6)	ilvB SMU_231		567	61644	"PATHWAY: Amino-acid biosynthesis; L-isoleucine biosynthesis; L-isoleucine from 2-oxobutanoate: step 1/4. {ECO:0000256|ARBA:ARBA00004974, ECO:0000256|RuleBase:RU003591}.; PATHWAY: Amino-acid biosynthesis; L-valine biosynthesis; L-valine from pyruvate: step 1/4. {ECO:0000256|ARBA:ARBA00005025, ECO:0000256|RuleBase:RU003591}."	isoleucine biosynthetic process [GO:0009097]; L-valine biosynthetic process [GO:0009099]	acetolactate synthase complex [GO:0005948]	acetolactate synthase activity [GO:0003984]; flavin adenine dinucleotide binding [GO:0050660]; magnesium ion binding [GO:0000287]; thiamine pyrophosphate binding [GO:0030976]	
Q8DW43	Ketol-acid reductoisomerase (NADP(+)) (KARI) (EC 1.1.1.86) (Acetohydroxy-acid isomeroreductase) (AHIR) (Alpha-keto-beta-hydroxylacyl reductoisomerase) (Ketol-acid reductoisomerase type 1) (Ketol-acid reductoisomerase type I)	ilvC SMU_233		340	37285	PATHWAY: Amino-acid biosynthesis; L-isoleucine biosynthesis; L-isoleucine from 2-oxobutanoate: step 2/4. {ECO:0000255|HAMAP-Rule:MF_00435}.; PATHWAY: Amino-acid biosynthesis; L-valine biosynthesis; L-valine from pyruvate: step 2/4. {ECO:0000255|HAMAP-Rule:MF_00435}.	isoleucine biosynthetic process [GO:0009097]; L-valine biosynthetic process [GO:0009099]	cytosol [GO:0005829]	ketol-acid reductoisomerase activity [GO:0004455]; magnesium ion binding [GO:0000287]; NADP binding [GO:0050661]	
Q8DRT7	Dihydroxy-acid dehydratase (DAD) (EC 4.2.1.9)	ilvD SMU_2128		571	60780	PATHWAY: Amino-acid biosynthesis; L-isoleucine biosynthesis; L-isoleucine from 2-oxobutanoate: step 3/4. {ECO:0000255|HAMAP-Rule:MF_00012}.; PATHWAY: Amino-acid biosynthesis; L-valine biosynthesis; L-valine from pyruvate: step 3/4. {ECO:0000255|HAMAP-Rule:MF_00012}.	isoleucine biosynthetic process [GO:0009097]; L-valine biosynthetic process [GO:0009099]		"2 iron, 2 sulfur cluster binding [GO:0051537]; dihydroxy-acid dehydratase activity [GO:0004160]; magnesium ion binding [GO:0000287]"	
Q8DTW7	Branched-chain-amino-acid aminotransferase (EC 2.6.1.42)	ilvE SMU_1203		341	37732	"PATHWAY: Amino-acid biosynthesis; L-isoleucine biosynthesis; L-isoleucine from 2-oxobutanoate: step 4/4. {ECO:0000256|ARBA:ARBA00004824, ECO:0000256|RuleBase:RU004519}.; PATHWAY: Amino-acid biosynthesis; L-leucine biosynthesis; L-leucine from 3-methyl-2-oxobutanoate: step 4/4. {ECO:0000256|ARBA:ARBA00005072, ECO:0000256|RuleBase:RU004519}.; PATHWAY: Amino-acid biosynthesis; L-valine biosynthesis; L-valine from pyruvate: step 4/4. {ECO:0000256|ARBA:ARBA00004931, ECO:0000256|RuleBase:RU004519}."	isoleucine biosynthetic process [GO:0009097]; L-leucine biosynthetic process [GO:0009098]; L-valine biosynthetic process [GO:0009099]		L-isoleucine-2-oxoglutarate transaminase activity [GO:0052656]; L-leucine-2-oxoglutarate transaminase activity [GO:0052654]; L-valine-2-oxoglutarate transaminase activity [GO:0052655]	; 22868765
Q8DW44	Acetolactate synthase small subunit (AHAS) (ALS) (EC 2.2.1.6) (Acetohydroxy-acid synthase small subunit)	ilvH SMU_232		160	17865	"PATHWAY: Amino-acid biosynthesis; L-isoleucine biosynthesis; L-isoleucine from 2-oxobutanoate: step 1/4. {ECO:0000256|ARBA:ARBA00004974, ECO:0000256|RuleBase:RU368092}.; PATHWAY: Amino-acid biosynthesis; L-valine biosynthesis; L-valine from pyruvate: step 1/4. {ECO:0000256|ARBA:ARBA00005025, ECO:0000256|RuleBase:RU368092}."	isoleucine biosynthetic process [GO:0009097]; L-valine biosynthetic process [GO:0009099]	cytosol [GO:0005829]	acetolactate synthase activity [GO:0003984]; acetolactate synthase regulator activity [GO:1990610]	
Q8DW56	IrrE N-terminal-like domain-containing protein	immA SMU_219		143	16882					36201342; 36268794
Q8DW57	Transcriptional regulator	immR SMU_218		117	13587				DNA binding [GO:0003677]	36201342; 36268794
Q8DS34	Translation initiation factor IF-1	infA if1 SMU_2004		72	8245			cytosol [GO:0005829]	ribosome binding [GO:0043022]; rRNA binding [GO:0019843]; translation initiation factor activity [GO:0003743]	
Q8DVP9	Translation initiation factor IF-2	infB SMU_421		916	101538			cytosol [GO:0005829]	GTP binding [GO:0005525]; GTPase activity [GO:0003924]; translation initiation factor activity [GO:0003743]	
Q8DV22	Translation initiation factor IF-3	infC SMU_697		176	20103		ribosome disassembly [GO:0032790]	cytosol [GO:0005829]; membrane [GO:0016020]	ribosome binding [GO:0043022]; translation initiation factor activity [GO:0003743]	
Q8DS40	Putative 4-diphosphocytidyl-2-C-methyl-D-erythritol kinase (CMK) (EC 2.7.1.148) (4-(cytidine-5'-diphospho)-2-C-methyl-D-erythritol kinase)	ipk SMU_1996		282	30964		terpenoid biosynthetic process [GO:0016114]		4-(cytidine 5'-diphospho)-2-C-methyl-D-erythritol kinase activity [GO:0050515]; ATP binding [GO:0005524]	
Q8DUN8	RNA-binding protein KhpA (KH-domain protein A)	khpA SMU_866		79	8924		cell wall organization [GO:0071555]; peptidoglycan biosynthetic process [GO:0009252]; regulation of cell shape [GO:0008360]	cytoplasm [GO:0005737]	RNA binding [GO:0003723]	
Q8DVX2	RNA-binding protein KhpB (RNA-binding protein EloR)	khpB eloR SMU_338		322	36019		cell wall organization [GO:0071555]; peptidoglycan biosynthetic process [GO:0009252]; regulation of cell shape [GO:0008360]	cytoplasm [GO:0005737]	RNA binding [GO:0003723]	
P26423	Galactose-6-phosphate isomerase subunit LacA (EC 5.3.1.26)	lacA SMU_1496		142	15608	PATHWAY: Carbohydrate metabolism; D-galactose 6-phosphate degradation; D-tagatose 6-phosphate from D-galactose 6-phosphate: step 1/1. {ECO:0000255|HAMAP-Rule:MF_01555}.	"D-allose catabolic process [GO:0019316]; galactose catabolic process [GO:0019388]; lactose catabolic process via tagatose-6-phosphate [GO:0019512]; pentose-phosphate shunt, non-oxidative branch [GO:0009052]"		galactose-6-phosphate isomerase activity [GO:0050044]; ribose-5-phosphate isomerase activity [GO:0004751]	1400164; 
P26424	Galactose-6-phosphate isomerase subunit LacB (EC 5.3.1.26)	lacB SMU_1495		171	18950	PATHWAY: Carbohydrate metabolism; D-galactose 6-phosphate degradation; D-tagatose 6-phosphate from D-galactose 6-phosphate: step 1/1. {ECO:0000255|HAMAP-Rule:MF_01556}.	"D-allose catabolic process [GO:0019316]; galactose catabolic process [GO:0019388]; lactose catabolic process via tagatose-6-phosphate [GO:0019512]; pentose-phosphate shunt, non-oxidative branch [GO:0009052]"		galactose-6-phosphate isomerase activity [GO:0050044]; ribose-5-phosphate isomerase activity [GO:0004751]	1400164; 
P26421	Tagatose-6-phosphate kinase (EC 2.7.1.144) (Phosphotagatokinase)	lacC SMU_1494		310	33363	PATHWAY: Carbohydrate metabolism; D-tagatose 6-phosphate degradation; D-glyceraldehyde 3-phosphate and glycerone phosphate from D-tagatose 6-phosphate: step 1/2. {ECO:0000255|HAMAP-Rule:MF_01557}.	D-tagatose 6-phosphate catabolic process [GO:2001059]; lactose catabolic process via tagatose-6-phosphate [GO:0019512]	cytosol [GO:0005829]	ATP binding [GO:0005524]; phosphofructokinase activity [GO:0008443]; tagatose-6-phosphate kinase activity [GO:0009024]	1400164; 
P26425	"Tagatose 1,6-diphosphate aldolase 1 (EC 4.1.2.40) (D-tagatose-1,6-bisphosphate aldolase 1) (Tagatose-bisphosphate aldolase 1)"	lacD1 lacD SMU_1493		325	36490	PATHWAY: Carbohydrate metabolism; D-tagatose 6-phosphate degradation; D-glyceraldehyde 3-phosphate and glycerone phosphate from D-tagatose 6-phosphate: step 2/2.	6-sulfoquinovose(1-) catabolic process [GO:1902777]; D-tagatose 6-phosphate catabolic process [GO:2001059]; lactose catabolic process via tagatose-6-phosphate [GO:0019512]		6-deoxy-6-sulfofructose-1-phosphate aldolase activity [GO:0061595]; tagatose-6-phosphate kinase activity [GO:0009024]; tagatose-bisphosphate aldolase activity [GO:0009025]	1400164; 
Q8DWE5	"Tagatose 1,6-diphosphate aldolase 2 (EC 4.1.2.40) (D-tagatose-1,6-bisphosphate aldolase 2) (Tagatose-bisphosphate aldolase 2)"	lacD2 SMU_116		329	36558	PATHWAY: Carbohydrate metabolism; D-tagatose 6-phosphate degradation; D-glyceraldehyde 3-phosphate and glycerone phosphate from D-tagatose 6-phosphate: step 2/2.	6-sulfoquinovose(1-) catabolic process [GO:1902777]; D-tagatose 6-phosphate catabolic process [GO:2001059]; lactose catabolic process via tagatose-6-phosphate [GO:0019512]		6-deoxy-6-sulfofructose-1-phosphate aldolase activity [GO:0061595]; tagatose-6-phosphate kinase activity [GO:0009024]; tagatose-bisphosphate aldolase activity [GO:0009025]	
P50976	PTS system lactose-specific EIICB component (EIICB-Lac) (EII-Lac) [Includes: PTS system lactose-specific EIIC component (Lactose permease IIC component); PTS system lactose-specific EIIB component (EC 2.7.1.207) (Lactose-specific phosphotransferase enzyme IIB component)]	lacE SMU_1491		568	61420		carbohydrate derivative transport [GO:1901264]; phosphoenolpyruvate-dependent sugar phosphotransferase system [GO:0009401]	plasma membrane [GO:0005886]	kinase activity [GO:0016301]; protein-N(PI)-phosphohistidine-lactose phosphotransferase system transporter activity [GO:0022869]	1400164; 8277252; 
P26426	PTS system lactose-specific EIIA component (EIIA-Lac) (EIII-Lac) (Lactose-specific phosphotransferase enzyme IIA component)	lacF SMU_1492		104	11399		phosphoenolpyruvate-dependent sugar phosphotransferase system [GO:0009401]	cytoplasm [GO:0005737]	metal ion binding [GO:0046872]; transferase activity [GO:0016740]	1400164; ; 6480107
P50978	6-phospho-beta-galactosidase (EC 3.2.1.85) (Beta-D-phosphogalactoside galactohydrolase) (PGALase) (P-beta-Gal) (PBG)	lacG SMU_1490		468	53762	PATHWAY: Carbohydrate metabolism; lactose degradation; D-galactose 6-phosphate and beta-D-glucose from lactose 6-phosphate: step 1/1. {ECO:0000255|HAMAP-Rule:MF_01574}.	carbohydrate metabolic process [GO:0005975]; lactose catabolic process via tagatose-6-phosphate [GO:0019512]	cytosol [GO:0005829]	6-phospho-beta-galactosidase activity [GO:0033920]; beta-glucosidase activity [GO:0008422]	8277252; 
P26422	Lactose phosphotransferase system repressor	lacR SMU_1498		251	28704		lactose metabolic process [GO:0005988]		DNA binding [GO:0003677]; DNA-binding transcription factor activity [GO:0003700]	1400164; 
Q8DT77	Uncharacterized protein	lacX SMU_1489		298	34529		carbohydrate metabolic process [GO:0005975]		carbohydrate binding [GO:0030246]; isomerase activity [GO:0016853]	
P26283	L-lactate dehydrogenase (L-LDH) (EC 1.1.1.27)	ldh lct SMU_1115		328	35245	PATHWAY: Fermentation; pyruvate fermentation to lactate; (S)-lactate from pyruvate: step 1/1. {ECO:0000255|HAMAP-Rule:MF_00488}.	glycolytic process [GO:0006096]; lactate metabolic process [GO:0006089]	cytoplasm [GO:0005737]	L-lactate dehydrogenase activity [GO:0004459]	1937751; 
I6L926	Cytoplasmic membrane protein LemA-like protein	lemA SMU_1930		186	21010			membrane [GO:0016020]		
Q8DTF3	Elongation factor 4 (EF-4) (EC 3.6.5.n1) (Ribosomal back-translocase LepA)	lepA SMU_1394		611	68357		positive regulation of translation [GO:0045727]	plasma membrane [GO:0005886]	GTP binding [GO:0005525]; GTPase activity [GO:0003924]; ribosome binding [GO:0043022]; translation elongation factor activity [GO:0003746]	
Q8DTX9	Signal peptidase I (EC 3.4.21.89)	lepB SMU_1188		184	21295		signal peptide processing [GO:0006465]	plasma membrane [GO:0005886]	serine-type endopeptidase activity [GO:0004252]	
Q8DSC7	Signal peptidase I (EC 3.4.21.89)	lepC SMU_1874		195	22427		signal peptide processing [GO:0006465]	plasma membrane [GO:0005886]	serine-type endopeptidase activity [GO:0004252]	
Q8DTG2	2-isopropylmalate synthase (EC 2.3.3.13) (Alpha-IPM synthase) (Alpha-isopropylmalate synthase)	leuA SMU_1384		521	56877	"PATHWAY: Amino-acid biosynthesis; L-leucine biosynthesis; L-leucine from 3-methyl-2-oxobutanoate: step 1/4. {ECO:0000256|ARBA:ARBA00004689, ECO:0000256|HAMAP-Rule:MF_01025}."	L-leucine biosynthetic process [GO:0009098]	cytoplasm [GO:0005737]	2-isopropylmalate synthase activity [GO:0003852]; acetyl-CoA C-acetyltransferase activity [GO:0003985]; manganese ion binding [GO:0030145]	
Q8DTG3	3-isopropylmalate dehydrogenase (EC 1.1.1.85) (3-IPM-DH) (Beta-IPM dehydrogenase) (IMDH)	leuB SMU_1383		344	36700	PATHWAY: Amino-acid biosynthesis; L-leucine biosynthesis; L-leucine from 3-methyl-2-oxobutanoate: step 3/4. {ECO:0000255|HAMAP-Rule:MF_01033}.	L-leucine biosynthetic process [GO:0009098]	cytosol [GO:0005829]	3-isopropylmalate dehydrogenase activity [GO:0003862]; magnesium ion binding [GO:0000287]; NAD binding [GO:0051287]	
Q8DTG4	3-isopropylmalate dehydratase large subunit (EC 4.2.1.33) (Alpha-IPM isomerase) (IPMI) (Isopropylmalate isomerase)	leuC SMU_1382		461	50619	PATHWAY: Amino-acid biosynthesis; L-leucine biosynthesis; L-leucine from 3-methyl-2-oxobutanoate: step 2/4. {ECO:0000255|HAMAP-Rule:MF_01026}.	L-leucine biosynthetic process [GO:0009098]		"3-isopropylmalate dehydratase activity [GO:0003861]; 4 iron, 4 sulfur cluster binding [GO:0051539]; metal ion binding [GO:0046872]"	
Q8DTG5	3-isopropylmalate dehydratase small subunit (EC 4.2.1.33) (Alpha-IPM isomerase) (IPMI) (Isopropylmalate isomerase)	leuD SMU_1381		196	22689	PATHWAY: Amino-acid biosynthesis; L-leucine biosynthesis; L-leucine from 3-methyl-2-oxobutanoate: step 2/4. {ECO:0000255|HAMAP-Rule:MF_01031}.	L-leucine biosynthetic process [GO:0009098]	3-isopropylmalate dehydratase complex [GO:0009316]	3-isopropylmalate dehydratase activity [GO:0003861]	
Q8DS85	Leucine--tRNA ligase (EC 6.1.1.4) (Leucyl-tRNA synthetase) (LeuRS)	leuS SMU_1943		833	94410		leucyl-tRNA aminoacylation [GO:0006429]	cytosol [GO:0005829]	aminoacyl-tRNA deacylase activity [GO:0002161]; ATP binding [GO:0005524]; leucine-tRNA ligase activity [GO:0004823]	
Q8DS73	"PTS system, sugar-specific enzyme IIA component"	levD SMU_1961c		143	15184		phosphoenolpyruvate-dependent sugar phosphotransferase system [GO:0009401]	membrane [GO:0016020]	transferase activity [GO:0016740]	16987177; 18699864
Q8DS74	"PTS system, mannose-specific IIB component"	levE SMU_1960c		164	18214		phosphoenolpyruvate-dependent sugar phosphotransferase system [GO:0009401]	cytoplasm [GO:0005737]	kinase activity [GO:0016301]; protein-N(PI)-phosphohistidine-sugar phosphotransferase activity [GO:0008982]	16987177; 18699864
Q8DS75	"PTS system, mannose-specific IIC component (EC 2.7.1.69)"	levF SMU_1958c		283	29962		phosphoenolpyruvate-dependent sugar phosphotransferase system [GO:0009401]	plasma membrane [GO:0005886]	transferase activity [GO:0016740]	16987177; 18699864
Q8DS76	"PTS system, mannose-specific IID component (EC 2.7.1.69)"	levG SMU_1957		278	30156		phosphoenolpyruvate-dependent sugar phosphotransferase system [GO:0009401]	plasma membrane [GO:0005886]	transferase activity [GO:0016740]	16987177; 18699864
Q8DS72	Sugar-binding periplasmic protein	levQ SMU_1963c		435	49612					16987177; 18699864; 21364902
Q8DS71	Response regulator	levR SMU_1964c		226	25184		phosphorelay signal transduction system [GO:0000160]; regulation of DNA-templated transcription [GO:0006355]		DNA binding [GO:0003677]	16987177; 18699864; 21364902
Q8DS70	histidine kinase (EC 2.7.13.3)	levS SMU_1965c		440	50980			membrane [GO:0016020]	phosphorelay sensor kinase activity [GO:0000155]; protein dimerization activity [GO:0046983]	16987177; 18699864; 21364902
Q8DS69	Periplasmic sugar-binding protein	levT SMU_1966c		320	35914			cell envelope [GO:0030313]; membrane [GO:0016020]	carbohydrate binding [GO:0030246]	16987177; 18699864; 21364902
P72482	Phosphatidylglycerol--prolipoprotein diacylglyceryl transferase (EC 2.5.1.145)	lgt SMU_755		259	29850	PATHWAY: Protein modification; lipoprotein biosynthesis (diacylglyceryl transfer). {ECO:0000255|HAMAP-Rule:MF_01147}.	lipoprotein biosynthetic process [GO:0042158]	plasma membrane [GO:0005886]	phosphatidylglycerol-prolipoprotein diacylglyceryl transferase activity [GO:0008961]	
Q8DSZ8	Aldoketomutase (Ketone-aldehyde mutase) (Methylglyoxalase) (S-D-lactoylglutathione methylglyoxal lyase)	lguL SMU_1603		130	15271		methylglyoxal catabolic process to D-lactate via S-lactoyl-glutathione [GO:0019243]	cytoplasm [GO:0005737]	lactoylglutathione lyase activity [GO:0004462]; metal ion binding [GO:0046872]	
Q8DUF3	Transcriptional antiterminator LicT	licT SMU_977		224	25958		regulation of DNA-templated transcription [GO:0006355]			
Q8DT49	DNA ligase (EC 6.5.1.2) (Polydeoxyribonucleotide synthase [NAD(+)])	ligA SMU_1543		652	71842		DNA repair [GO:0006281]; DNA replication [GO:0006260]	cytosol [GO:0005829]	DNA binding [GO:0003677]; DNA ligase (NAD+) activity [GO:0003911]; metal ion binding [GO:0046872]	
Q8DSU4	"Branched chain amino acid ABC transporter, ATP-binding protein"	livF SMU_1665		236	25592		L-amino acid transport [GO:0015807]		ATP binding [GO:0005524]; ATP hydrolysis activity [GO:0016887]; branched-chain amino acid transmembrane transporter activity [GO:0015658]	
Q8DSU3	"Branched chain amino acid ABC transporter, ATP-binding protein"	livG SMU_1666		254	28286		D-alanine transmembrane transport [GO:0042941]; L-alanine transport [GO:0015808]; L-isoleucine import across plasma membrane [GO:1903806]; L-valine import across plasma membrane [GO:1903805]	plasma membrane [GO:0005886]	ATP binding [GO:0005524]; ATP hydrolysis activity [GO:0016887]; L-isoleucine transmembrane transporter activity [GO:0015188]; L-phenylalanine transmembrane transporter activity [GO:0015192]; L-valine transmembrane transporter activity [GO:0005304]	
