Q8DUK4	"ABC transporter, ATP-binding protein"	rcrQ SMU_923		584	64591			plasma membrane [GO:0005886]	ABC-type oligopeptide transporter activity [GO:0015421]; ATP binding [GO:0005524]; ATP hydrolysis activity [GO:0016887]	
Q8DUK6	Transcriptional regulator	rcrR SMU_921		144	16721				DNA-binding transcription factor activity [GO:0003700]	
P27624	Protein RecA (Recombinase A)	recA SMU_2085		383	41420		DNA recombination [GO:0006310]; DNA repair [GO:0006281]; SOS response [GO:0009432]	cytosol [GO:0005829]	ATP binding [GO:0005524]; ATP hydrolysis activity [GO:0016887]; ATP-dependent DNA damage sensor activity [GO:0140664]; damaged DNA binding [GO:0003684]; single-stranded DNA binding [GO:0003697]	; 1628842; 1556091
Q8DSC6	ATP-dependent RecD2 DNA helicase (EC 5.6.2.3) (DNA 5'-3' helicase subunit RecD2)	recD2 SMU_1875		787	88886		DNA recombination [GO:0006310]	exodeoxyribonuclease V complex [GO:0009338]	5'-3' DNA helicase activity [GO:0043139]; ATP binding [GO:0005524]; ATP hydrolysis activity [GO:0016887]; DNA binding [GO:0003677]; single-stranded DNA helicase activity [GO:0017116]	
Q8DRR3	DNA replication and repair protein RecF	recF SMU_2156		363	42003		DNA replication [GO:0006260]; DNA synthesis involved in DNA repair [GO:0000731]; double-strand break repair [GO:0006302]; SOS response [GO:0009432]	cytoplasm [GO:0005737]	ATP binding [GO:0005524]; single-stranded DNA binding [GO:0003697]	
Q8DSF5	ATP-dependent DNA helicase RecG (EC 5.6.2.4)	recG SMU_1833		671	75373		DNA recombination [GO:0006310]; DNA repair [GO:0006281]		ATP binding [GO:0005524]; ATP hydrolysis activity [GO:0016887]; DNA binding [GO:0003677]; DNA helicase activity [GO:0003678]	
Q8DT92	Single-stranded-DNA-specific exonuclease RecJ	recJ SMU_1472		734	82410		DNA recombination [GO:0006310]; DNA repair [GO:0006281]		5'-3' exonuclease activity [GO:0008409]; nucleic acid binding [GO:0003676]	
Q8DVB0	DNA repair protein RecN (Recombination protein N)	recN SMU_585		552	62739		DNA recombination [GO:0006310]; DNA repair [GO:0006281]; SOS response [GO:0009432]	bacterial nucleoid [GO:0043590]	ATP binding [GO:0005524]	
Q8DWM0	DNA repair protein RecO (Recombination protein O)	recO SMU_25		251	29354		DNA recombination [GO:0006310]; double-strand break repair [GO:0006302]	bacterial nucleoid [GO:0043590]		
Q8DV99	Recombination protein RecR	recR SMU_598		199	21819		DNA recombination [GO:0006310]; DNA repair [GO:0006281]		DNA binding [GO:0003677]; zinc ion binding [GO:0008270]	
Q8DVL3	Holliday junction resolvase RecU (EC 3.1.21.10) (Recombination protein U homolog)	recU SMU_469		197	22815		chromosome segregation [GO:0007059]; DNA recombination [GO:0006310]; DNA repair [GO:0006281]	cytoplasm [GO:0005737]	endonuclease activity [GO:0004519]; magnesium ion binding [GO:0000287]; nucleic acid binding [GO:0003676]	
Q8DSK2	Regulatory protein RecX	recX SMU_1780		258	30736		regulation of DNA repair [GO:0006282]	cytoplasm [GO:0005737]		
Q8DS07	GTP diphosphokinase (EC 2.7.6.5)	relA SMU_2044		740	84094	PATHWAY: Purine metabolism; ppGpp biosynthesis; ppGpp from GTP: step 1/2. {ECO:0000256|ARBA:ARBA00004976}.	guanosine tetraphosphate biosynthetic process [GO:0015970]	plasma membrane [GO:0005886]	GTP binding [GO:0005525]; GTP diphosphokinase activity [GO:0008728]; metal ion binding [GO:0046872]	
Q8DU91	Redox-sensing transcriptional repressor Rex	rex SMU_1053		213	23834		negative regulation of DNA-templated transcription [GO:0045892]; response to redox state [GO:0051775]	cytoplasm [GO:0005737]	DNA binding [GO:0003677]; DNA-binding transcription factor activity [GO:0003700]	
Q8DT75	ATP-dependent helicase/deoxyribonuclease subunit B (EC 3.1.-.-) (ATP-dependent helicase/nuclease subunit RexB)	rexB SMU_1500		1080	123793		double-strand break repair via homologous recombination [GO:0000724]		"5'-3' exonuclease activity [GO:0008409]; ATP binding [GO:0005524]; double-stranded DNA binding [GO:0003690]; helicase activity [GO:0004386]; hydrolase activity, acting on acid anhydrides [GO:0016817]"	
Q8DTK9	Peptide chain release factor 2 (RF-2)	rf2 prfB SMU_1326		325	36952			cytoplasm [GO:0005737]	"translation release factor activity, codon specific [GO:0016149]"	
Q8DT68	Transcriptional regulator	rgg SMU_1509		285	33899				DNA binding [GO:0003677]	
Q1LZ66	RggA-like protein	rgl		263	30964					11750824
Q8DUS4	RgpAc glycosyltransferase	rgpA SMU_825		362	42121				glycosyltransferase activity [GO:0016757]	31210392
Q8DUS3	Rhamnosyltransferase	rgpB SMU_826		311	36609				glycosyltransferase activity [GO:0016757]	31210392
I6L8Z4	Transport permease protein	rgpC SMU_827		269	30670		lipopolysaccharide transport [GO:0015920]	plasma membrane [GO:0005886]	ABC-type transporter activity [GO:0140359]	31210392
I6L8X8	"Polysaccharide ABC transporter, ATP-binding protein"	rgpD SMU_828		405	45481			membrane [GO:0016020]	ABC-type transporter activity [GO:0140359]; ATP binding [GO:0005524]; ATP hydrolysis activity [GO:0016887]	31210392
Q8DUS2	Glycosyltransferase	rgpE SMU_829		465	54889					31210392
Q8DUS1	RgpFc protein	rgpF SMU_830		583	68348					31210392
Q8CZF2	"Glycosyl transferase N-acetylglucosaminyltransferase, RgpG"	rgpG SMU_246		386	42601		cell wall macromolecule biosynthetic process [GO:0044038]; cell wall organization [GO:0071555]; lipopolysaccharide biosynthetic process [GO:0009103]	plasma membrane [GO:0005886]	"glycosyltransferase activity [GO:0016757]; metal ion binding [GO:0046872]; phosphotransferase activity, for other substituted phosphate groups [GO:0016780]"	31210392
Q8DUS0	Sulfatase N-terminal domain-containing protein	rgpH SMU_831		846	96537			membrane [GO:0016020]		31210392
Q8DUR9	Glycosyltransferase	rgpI SMU_833		308	35063			plasma membrane [GO:0005886]		31210392; 39976456
Q8DUN7	Ribosome maturation factor RimM	rimM SMU_867		172	19823		ribosomal small subunit biogenesis [GO:0042274]; rRNA processing [GO:0006364]	cytoplasm [GO:0005737]; ribosome [GO:0005840]	ribosome binding [GO:0043022]	
Q8DVQ3	Ribosome maturation factor RimP	rimP SMU_417		163	18070		ribosomal small subunit assembly [GO:0000028]; translation [GO:0006412]	cytosol [GO:0005829]		
Q8DRQ7	Ribosomal RNA large subunit methyltransferase H (EC 2.1.1.177) (23S rRNA (pseudouridine1915-N3)-methyltransferase) (23S rRNA m3Psi1915 methyltransferase) (rRNA (pseudouridine-N3-)-methyltransferase RlmH)	rlmH SMU_2162c		159	18267			cytoplasm [GO:0005737]	rRNA (pseudouridine-N3-)-methyltransferase activity [GO:0070038]	
Q8DVG8	Probable dual-specificity RNA methyltransferase RlmN (EC 2.1.1.192) (23S rRNA (adenine(2503)-C(2))-methyltransferase) (23S rRNA m2A2503 methyltransferase) (Ribosomal RNA large subunit methyltransferase N) (tRNA (adenine(37)-C(2))-methyltransferase) (tRNA m2A37 methyltransferase)	rlmN SMU_522		361	41152		rRNA base methylation [GO:0070475]; tRNA methylation [GO:0030488]	cytoplasm [GO:0005737]	"4 iron, 4 sulfur cluster binding [GO:0051539]; metal ion binding [GO:0046872]; rRNA (adenine(2503)-C2-)-methyltransferase activity [GO:0070040]; rRNA binding [GO:0019843]; tRNA (adenine(37)-C2)-methyltransferase activity [GO:0002935]; tRNA binding [GO:0000049]"	
Q8DSR0	Pseudouridine synthase (EC 5.4.99.-)	rluB SMU_1711		240	27203		enzyme-directed rRNA pseudouridine synthesis [GO:0000455]	cytosol [GO:0005829]	RNA binding [GO:0003723]; rRNA pseudouridine synthase activity [GO:0120159]	
P95778	Glucose-1-phosphate thymidylyltransferase (EC 2.7.7.24) (dTDP-glucose pyrophosphorylase) (dTDP-glucose synthase)	rmlA SMU_1461		289	32295	PATHWAY: Carbohydrate biosynthesis; dTDP-L-rhamnose biosynthesis.; PATHWAY: Capsule biogenesis; capsule polysaccharide biosynthesis.	capsule polysaccharide biosynthetic process [GO:0045227]; dTDP-rhamnose biosynthetic process [GO:0019305]		glucose-1-phosphate thymidylyltransferase activity [GO:0008879]; metal ion binding [GO:0046872]	9023194; 
P95780	"dTDP-glucose 4,6-dehydratase (EC 4.2.1.46)"	rmlB SMU_1457		348	39281	PATHWAY: Carbohydrate biosynthesis; dTDP-L-rhamnose biosynthesis. {ECO:0000250|UniProtKB:P37759}.	dTDP-rhamnose biosynthetic process [GO:0019305]; lipopolysaccharide biosynthetic process [GO:0009103]; polysaccharide biosynthetic process [GO:0000271]		"dTDP-glucose 4,6-dehydratase activity [GO:0008460]"	; 11796113
Q8DTA1	dTDP-4-keto-L-rhamnose reductase (EC 5.1.3.13)	rmlC SMU_1460		153	17222		dTDP-rhamnose biosynthetic process [GO:0019305]; polysaccharide biosynthetic process [GO:0000271]	cytosol [GO:0005829]	"dTDP-4-dehydrorhamnose 3,5-epimerase activity [GO:0008830]"	
Q8DUS5	dTDP-4-dehydrorhamnose reductase (EC 1.1.1.133)	rmlD SMU_824		284	32412	PATHWAY: Carbohydrate biosynthesis; dTDP-L-rhamnose biosynthesis. {ECO:0000256|RuleBase:RU364082}.	dTDP-rhamnose biosynthetic process [GO:0019305]	cytosol [GO:0005829]	dTDP-4-dehydrorhamnose reductase activity [GO:0008831]	31210392
Q8DT66	Ribonuclease 3 (EC 3.1.26.3) (Ribonuclease III) (RNase III)	rnc SMU_1514		231	26029		mRNA processing [GO:0006397]; regulation of gene expression [GO:0010468]; rRNA processing [GO:0006364]; tRNA processing [GO:0008033]	cytoplasm [GO:0005737]	double-stranded RNA binding [GO:0003725]; metal ion binding [GO:0046872]; ribonuclease III activity [GO:0004525]; rRNA binding [GO:0019843]	; 24270795
Q8DUE1	Ribonuclease HII (RNase HII) (EC 3.1.26.4)	rnhB rnh SMU_994		260	28913		"DNA replication, removal of RNA primer [GO:0043137]; mismatch repair [GO:0006298]"	cytoplasm [GO:0005737]; ribonuclease H2 complex [GO:0032299]	manganese ion binding [GO:0030145]; RNA binding [GO:0003723]; RNA-DNA hybrid ribonuclease activity [GO:0004523]	
Q8DSC8	Ribonuclease HIII (RNase HIII) (EC 3.1.26.4)	rnhC SMU_1873		303	33831		"DNA replication, removal of RNA primer [GO:0043137]; mismatch repair [GO:0006298]"	cytoplasm [GO:0005737]; ribonuclease H2 complex [GO:0032299]	magnesium ion binding [GO:0000287]; RNA binding [GO:0003723]; RNA-DNA hybrid ribonuclease activity [GO:0004523]	
Q8DTB3	Ribonuclease J (RNase J) (EC 3.1.-.-)	rnj SMU_1444c		554	61828		rRNA processing [GO:0006364]	cytoplasm [GO:0005737]	5'-3' RNA exonuclease activity [GO:0004534]; RNA binding [GO:0003723]; RNA endonuclease activity [GO:0004521]; zinc ion binding [GO:0008270]	
Q8DVU7	Ribonuclease J (RNase J) (EC 3.1.-.-)	rnj SMU_368c		560	61352		rRNA processing [GO:0006364]	cytoplasm [GO:0005737]	5'-3' RNA exonuclease activity [GO:0004534]; RNA binding [GO:0003723]; RNA endonuclease activity [GO:0004521]; zinc ion binding [GO:0008270]	
Q8DVW8	Ribonuclease M5 (EC 3.1.26.8) (RNase M5) (Ribosomal RNA terminal maturase M5)	rnmV SMU_342		211	24365		rRNA processing [GO:0006364]	cytoplasm [GO:0005737]	metal ion binding [GO:0046872]; ribonuclease M5 activity [GO:0043822]; rRNA binding [GO:0019843]	
Q8DVX4	Ribonuclease P protein component (RNase P protein) (RNaseP protein) (EC 3.1.26.5) (Protein C5)	rnpA SMU_336		119	13728		tRNA 5'-leader removal [GO:0001682]	ribonuclease P complex [GO:0030677]	3'-tRNA processing endoribonuclease activity [GO:0042781]; ribonuclease P activity [GO:0004526]; tRNA binding [GO:0000049]	
Q8DVK7	Ribonuclease Y (RNase Y) (EC 3.1.-.-)	rny SMU_475		535	60343		mRNA catabolic process [GO:0006402]	plasma membrane [GO:0005886]	RNA binding [GO:0003723]; RNA endonuclease activity [GO:0004521]	
Q8DT90	Ribonuclease Z (RNase Z) (EC 3.1.26.11) (tRNA 3 endonuclease) (tRNase Z)	rnz SMU_1474c		309	34411				3'-tRNA processing endoribonuclease activity [GO:0042781]; zinc ion binding [GO:0008270]	
Q8DVW0	Ribulose-phosphate 3-epimerase (EC 5.1.3.1)	rpe SMU_352		219	23722	PATHWAY: Carbohydrate degradation. {ECO:0000256|HAMAP-Rule:MF_02227}.	pentose catabolic process [GO:0019323]; pentose-phosphate shunt [GO:0006098]	cytoplasm [GO:0005737]	D-ribulose-phosphate 3-epimerase activity [GO:0004750]; metal ion binding [GO:0046872]	
Q8DTT9	Ribose-5-phosphate isomerase A (EC 5.3.1.6) (Phosphoriboisomerase A) (PRI)	rpiA SMU_1234		225	24568	PATHWAY: Carbohydrate degradation; pentose phosphate pathway; D-ribose 5-phosphate from D-ribulose 5-phosphate (non-oxidative stage): step 1/1. {ECO:0000255|HAMAP-Rule:MF_00170}.	"pentose-phosphate shunt, non-oxidative branch [GO:0009052]"		ribose-5-phosphate isomerase activity [GO:0004751]	
Q8DRS5	Sugar-phosphate isomerase	rpiB SMU_2142		210	23401		lactose metabolic process [GO:0005988]		"intramolecular oxidoreductase activity, interconverting aldoses and ketoses [GO:0016861]"	
Q1LZ65	RpiR-like protein	rpl		274	31485		carbohydrate derivative metabolic process [GO:1901135]		carbohydrate derivative binding [GO:0097367]; DNA binding [GO:0003677]; DNA-binding transcription factor activity [GO:0003700]	11750824
Q8DSY0	Large ribosomal subunit protein uL1 (50S ribosomal protein L1)	rplA SMU_1626		229	24510		regulation of translation [GO:0006417]; translation [GO:0006412]	large ribosomal subunit [GO:0015934]	rRNA binding [GO:0019843]; structural constituent of ribosome [GO:0003735]; tRNA binding [GO:0000049]	
G1XVB9	Large ribosomal subunit protein uL2	rplB SMU_2167		279	30216		cytoplasmic translation [GO:0002181]	large ribosomal subunit [GO:0015934]	rRNA binding [GO:0019843]; structural constituent of ribosome [GO:0003735]; transferase activity [GO:0016740]	
Q8DS16	Large ribosomal subunit protein uL3 (50S ribosomal protein L3)	rplC SMU_2025		208	22383		translation [GO:0006412]	cytosolic large ribosomal subunit [GO:0022625]	rRNA binding [GO:0019843]; structural constituent of ribosome [GO:0003735]	
Q8DS17	Large ribosomal subunit protein uL4	rplD SMU_2024c		207	22228		translation [GO:0006412]	ribonucleoprotein complex [GO:1990904]; ribosome [GO:0005840]	rRNA binding [GO:0019843]; structural constituent of ribosome [GO:0003735]	
Q8DS25	Large ribosomal subunit protein uL5 (50S ribosomal protein L5)	rplE rl5 SMU_2015		180	19811		translation [GO:0006412]	ribonucleoprotein complex [GO:1990904]; ribosome [GO:0005840]	rRNA binding [GO:0019843]; structural constituent of ribosome [GO:0003735]; tRNA binding [GO:0000049]	
Q8DS28	Large ribosomal subunit protein uL6 (50S ribosomal protein L6)	rplF SMU_2011		178	19436		cytoplasmic translation [GO:0002181]	cytosolic large ribosomal subunit [GO:0022625]	rRNA binding [GO:0019843]; structural constituent of ribosome [GO:0003735]	
Q8DRS8	Large ribosomal subunit protein bL9 (50S ribosomal protein L9)	rplI SMU_2139c		150	16771		translation [GO:0006412]	ribonucleoprotein complex [GO:1990904]; ribosome [GO:0005840]	rRNA binding [GO:0019843]; structural constituent of ribosome [GO:0003735]	
Q8DUH2	Large ribosomal subunit protein uL10 (50S ribosomal protein L10)	rplJ SMU_957		167	17667		translation [GO:0006412]	large ribosomal subunit [GO:0015934]	large ribosomal subunit rRNA binding [GO:0070180]; structural constituent of ribosome [GO:0003735]	
Q8DSX9	Large ribosomal subunit protein uL11 (50S ribosomal protein L11)	rplK rl11 SMU_1627		141	14816		translation [GO:0006412]	cytosolic large ribosomal subunit [GO:0022625]	large ribosomal subunit rRNA binding [GO:0070180]; structural constituent of ribosome [GO:0003735]	
Q8DUG9	Large ribosomal subunit protein bL12 (50S ribosomal protein L7/L12)	rplL SMU_960		122	12413		translation [GO:0006412]	cytosolic large ribosomal subunit [GO:0022625]	mRNA binding [GO:0003729]; structural constituent of ribosome [GO:0003735]	
Q8DW98	Large ribosomal subunit protein uL13	rplM SMU_169		148	16216		negative regulation of translation [GO:0017148]; translation [GO:0006412]	cytosolic large ribosomal subunit [GO:0022625]	mRNA binding [GO:0003729]; structural constituent of ribosome [GO:0003735]	
Q8DS23	Large ribosomal subunit protein uL14 (50S ribosomal protein L14)	rplN SMU_2017		122	13021		translation [GO:0006412]	cytosolic large ribosomal subunit [GO:0022625]	large ribosomal subunit rRNA binding [GO:0070180]; structural constituent of ribosome [GO:0003735]	
Q8DS31	Large ribosomal subunit protein uL15 (50S ribosomal protein L15)	rplO SMU_2007		146	15446		translation [GO:0006412]	cytosolic large ribosomal subunit [GO:0022625]	rRNA binding [GO:0019843]; structural constituent of ribosome [GO:0003735]	
Q8DS20	Large ribosomal subunit protein uL16 (50S ribosomal protein L16)	rplP SMU_2020		137	15502		translation [GO:0006412]	cytosolic large ribosomal subunit [GO:0022625]	rRNA binding [GO:0019843]; structural constituent of ribosome [GO:0003735]; tRNA binding [GO:0000049]	
Q8DS37	Large ribosomal subunit protein bL17 (50S ribosomal protein L17)	rplQ SMU_2000		128	14540		translation [GO:0006412]	cytosolic large ribosomal subunit [GO:0022625]	structural constituent of ribosome [GO:0003735]	
Q8DS29	Large ribosomal subunit protein uL18 (50S ribosomal protein L18)	rplR rl18 SMU_2010		118	12894		translation [GO:0006412]	cytosolic large ribosomal subunit [GO:0022625]	5S rRNA binding [GO:0008097]; structural constituent of ribosome [GO:0003735]	
Q8DTP5	Large ribosomal subunit protein bL19 (50S ribosomal protein L19)	rplS rl19 SMU_1288		115	13152		translation [GO:0006412]	cytosolic large ribosomal subunit [GO:0022625]	structural constituent of ribosome [GO:0003735]	
Q8DV20	Large ribosomal subunit protein bL20 (50S ribosomal protein L20)	rplT SMU_699		119	13751		ribosomal large subunit assembly [GO:0000027]; translation [GO:0006412]	ribonucleoprotein complex [GO:1990904]; ribosome [GO:0005840]	rRNA binding [GO:0019843]; structural constituent of ribosome [GO:0003735]	
Q8DUQ6	Large ribosomal subunit protein bL21 (50S ribosomal protein L21)	rplU SMU_846		104	11284		translation [GO:0006412]	cytoplasm [GO:0005737]; ribonucleoprotein complex [GO:1990904]; ribosome [GO:0005840]	rRNA binding [GO:0019843]; structural constituent of ribosome [GO:0003735]	
Q8DS19	Large ribosomal subunit protein uL22 (50S ribosomal protein L22)	rplV rl22 SMU_2022		114	12445		translation [GO:0006412]	cytosolic large ribosomal subunit [GO:0022625]	rRNA binding [GO:0019843]; structural constituent of ribosome [GO:0003735]	
G1XVC0	Large ribosomal subunit protein uL23	rplW SMU_2166		99	10986		translation [GO:0006412]	ribonucleoprotein complex [GO:1990904]; ribosome [GO:0005840]	rRNA binding [GO:0019843]; structural constituent of ribosome [GO:0003735]	
Q8DS24	Large ribosomal subunit protein uL24 (50S ribosomal protein L24)	rplX rl24 SMU_2016		101	10971		translation [GO:0006412]	ribonucleoprotein complex [GO:1990904]; ribosome [GO:0005840]	rRNA binding [GO:0019843]; structural constituent of ribosome [GO:0003735]	
Q8DUQ4	Large ribosomal subunit protein bL27 (50S ribosomal protein L27)	rpmA SMU_849		97	10421		translation [GO:0006412]	cytosolic large ribosomal subunit [GO:0022625]	structural constituent of ribosome [GO:0003735]	
Q8DWE1	Large ribosomal subunit protein bL28 (50S ribosomal protein L28)	rpmB SMU_120		62	6898		translation [GO:0006412]	ribonucleoprotein complex [GO:1990904]; ribosome [GO:0005840]	structural constituent of ribosome [GO:0003735]	
Q8DS21	Large ribosomal subunit protein uL29 (50S ribosomal protein L29)	rpmC SMU_2019		69	8030		translation [GO:0006412]	cytosolic large ribosomal subunit [GO:0022625]	structural constituent of ribosome [GO:0003735]	
Q8DS30	Large ribosomal subunit protein uL30 (50S ribosomal protein L30)	rpmD SMU_2008		60	6382		translation [GO:0006412]	cytosolic large ribosomal subunit [GO:0022625]	structural constituent of ribosome [GO:0003735]	
Q8DTN5	Large ribosomal subunit protein bL31B (50S ribosomal protein L31 type B)	rpmE2 rl31 SMU_1298		80	9303		translation [GO:0006412]	ribonucleoprotein complex [GO:1990904]; ribosome [GO:0005840]	structural constituent of ribosome [GO:0003735]	; 19429620
Q8DRV7	Large ribosomal subunit protein bL32 (50S ribosomal protein L32)	rpmF SMU_2104a		60	6826		translation [GO:0006412]	large ribosomal subunit [GO:0015934]	structural constituent of ribosome [GO:0003735]	
Q8DSZ3	Large ribosomal subunit protein bL33 (50S ribosomal protein L33)	rpmG SMU_1610		48	5652		translation [GO:0006412]	cytoplasm [GO:0005737]; ribonucleoprotein complex [GO:1990904]; ribosome [GO:0005840]	structural constituent of ribosome [GO:0003735]	
Q8DVX0	Large ribosomal subunit protein bL34 (50S ribosomal protein L34)	rpmH SMU_340		44	5345		translation [GO:0006412]	ribonucleoprotein complex [GO:1990904]; ribosome [GO:0005840]	structural constituent of ribosome [GO:0003735]	
Q8DV21	Large ribosomal subunit protein bL35 (50S ribosomal protein L35)	rpmI SMU_698		66	7836		translation [GO:0006412]	cytosolic large ribosomal subunit [GO:0022625]	structural constituent of ribosome [GO:0003735]	
P66308	Large ribosomal subunit protein bL36 (50S ribosomal protein L36)	rpmJ SMU_2003.1 SMU_2003a		38	4451		translation [GO:0006412]	cytoplasm [GO:0005737]; ribonucleoprotein complex [GO:1990904]; ribosome [GO:0005840]	structural constituent of ribosome [GO:0003735]	
Q8DS36	DNA-directed RNA polymerase subunit alpha (RNAP subunit alpha) (EC 2.7.7.6) (RNA polymerase subunit alpha) (Transcriptase subunit alpha)	rpoA SMU_2001		312	34570		DNA-templated transcription [GO:0006351]	cytoplasm [GO:0005737]; DNA-directed RNA polymerase complex [GO:0000428]	DNA binding [GO:0003677]; DNA-directed RNA polymerase activity [GO:0003899]; protein dimerization activity [GO:0046983]	
Q8DS46	DNA-directed RNA polymerase subunit beta (RNAP subunit beta) (EC 2.7.7.6) (RNA polymerase subunit beta) (Transcriptase subunit beta)	rpoB SMU_1990		1187	132717		DNA-templated transcription [GO:0006351]	DNA-directed RNA polymerase complex [GO:0000428]	DNA binding [GO:0003677]; DNA-directed RNA polymerase activity [GO:0003899]; ribonucleoside binding [GO:0032549]	
Q8DS47	DNA-directed RNA polymerase subunit beta' (RNAP subunit beta') (EC 2.7.7.6) (RNA polymerase subunit beta') (Transcriptase subunit beta')	rpoC SMU_1989		1209	134977		DNA-templated transcription [GO:0006351]	DNA-directed RNA polymerase complex [GO:0000428]	DNA binding [GO:0003677]; DNA-directed RNA polymerase activity [GO:0003899]; magnesium ion binding [GO:0000287]; zinc ion binding [GO:0008270]	
Q8DWG2	Probable DNA-directed RNA polymerase subunit delta (RNAP delta factor)	rpoE SMU_96		194	22478		DNA-templated transcription [GO:0006351]; regulation of DNA-templated transcription [GO:0006355]	DNA-directed RNA polymerase complex [GO:0000428]	DNA-directed RNA polymerase activity [GO:0003899]	
Q8DVU6	DNA-directed RNA polymerase subunit epsilon (RNAP epsilon subunit) (EC 2.7.7.6) (RNA polymerase epsilon subunit) (Transcriptase subunit epsilon)	rpoY SMU_369c		76	9075		DNA-templated transcription [GO:0006351]	DNA-directed RNA polymerase complex [GO:0000428]	DNA binding [GO:0003677]; DNA-directed RNA polymerase activity [GO:0003899]	
Q8DVK5	DNA-directed RNA polymerase subunit omega (RNAP omega subunit) (EC 2.7.7.6) (RNA polymerase omega subunit) (Transcriptase subunit omega)	rpoZ SMU_479		105	11731		DNA-templated transcription [GO:0006351]	DNA-directed RNA polymerase complex [GO:0000428]	DNA binding [GO:0003677]; DNA-directed RNA polymerase activity [GO:0003899]	
Q8DS11	Small ribosomal subunit protein uS2 (30S ribosomal protein S2)	rpsB rs2 SMU_2032		261	29093		translation [GO:0006412]	cytosolic small ribosomal subunit [GO:0022627]	structural constituent of ribosome [GO:0003735]	
P59186	Small ribosomal subunit protein uS3 (30S ribosomal protein S3)	rpsC rs3 SMU_2021		217	24122		translation [GO:0006412]	cytosolic small ribosomal subunit [GO:0022627]	mRNA binding [GO:0003729]; rRNA binding [GO:0019843]; structural constituent of ribosome [GO:0003735]	
P59133	Small ribosomal subunit protein uS4 (30S ribosomal protein S4)	rpsD SMU_2135c		203	23035		ribosomal small subunit biogenesis [GO:0042274]; translation [GO:0006412]	small ribosomal subunit [GO:0015935]	rRNA binding [GO:0019843]; structural constituent of ribosome [GO:0003735]	
P59125	Small ribosomal subunit protein uS5 (30S ribosomal protein S5)	rpsE rs5 SMU_2009		164	17121		translation [GO:0006412]	small ribosomal subunit [GO:0015935]	rRNA binding [GO:0019843]; structural constituent of ribosome [GO:0003735]	
Q8DSD7	Small ribosomal subunit protein bS6 (30S ribosomal protein S6)	rpsF rs6 SMU_1860		96	11247		translation [GO:0006412]	cytoplasm [GO:0005737]; ribonucleoprotein complex [GO:1990904]; ribosome [GO:0005840]	small ribosomal subunit rRNA binding [GO:0070181]; structural constituent of ribosome [GO:0003735]	
Q8DVV5	Small ribosomal subunit protein uS7 (30S ribosomal protein S7)	rpsG SMU_358		156	17805		translation [GO:0006412]	small ribosomal subunit [GO:0015935]	rRNA binding [GO:0019843]; structural constituent of ribosome [GO:0003735]; tRNA binding [GO:0000049]	
Q8DS27	Small ribosomal subunit protein uS8 (30S ribosomal protein S8)	rpsH SMU_2012		132	14693		translation [GO:0006412]	ribonucleoprotein complex [GO:1990904]; ribosome [GO:0005840]	rRNA binding [GO:0019843]; structural constituent of ribosome [GO:0003735]	
Q8DW97	Small ribosomal subunit protein uS9 (30S ribosomal protein S9)	rpsI SMU_170		130	14220		translation [GO:0006412]	cytosolic small ribosomal subunit [GO:0022627]	RNA binding [GO:0003723]; structural constituent of ribosome [GO:0003735]	
P48853	Small ribosomal subunit protein uS10 (30S ribosomal protein S10)	rpsJ SMU_2026c		102	11586		translation [GO:0006412]	ribonucleoprotein complex [GO:1990904]; ribosome [GO:0005840]	structural constituent of ribosome [GO:0003735]; tRNA binding [GO:0000049]	
P59378	Small ribosomal subunit protein uS11 (30S ribosomal protein S11)	rpsK rs11 SMU_2002		127	13399		translation [GO:0006412]	ribonucleoprotein complex [GO:1990904]; ribosome [GO:0005840]	rRNA binding [GO:0019843]; structural constituent of ribosome [GO:0003735]	
P59167	Small ribosomal subunit protein uS12 (30S ribosomal protein S12)	rpsL SMU_357		137	15109		translation [GO:0006412]	small ribosomal subunit [GO:0015935]	rRNA binding [GO:0019843]; structural constituent of ribosome [GO:0003735]; tRNA binding [GO:0000049]	
Q8DS35	Small ribosomal subunit protein uS13 (30S ribosomal protein S13)	rpsM rs13 SMU_2003		121	13406		translation [GO:0006412]	cytosol [GO:0005829]; small ribosomal subunit [GO:0015935]	rRNA binding [GO:0019843]; structural constituent of ribosome [GO:0003735]; tRNA binding [GO:0000049]	
